{
  "track_id": "fixture:candidate:idle_breathe:front_left:neutral:1",
  "clip_id": "idle_breathe",
  "version": 2,
  "body_revision": "mon-body-v2-r03",
  "stage": "candidate",
  "family": "idle_breathe",
  "facing": "front_left",
  "travel_direction": null,
  "posture": "neutral",
  "variant": 1,
  "source_revision": "fixture",
  "source_reference_sha256": "86ce1f9428f9a998d57e1a99c4245347d5a05e9f0bcf853c2b68065f351bdb56",
  "frame_profile": "MON_FRAME_V1",
  "fps": 24,
  "frames": [{
    "frame_id": "fixture_00",
    "frame_index": 0,
    "duration_ticks": 1,
    "path": "frames/fixture_00.png",
    "sha256": "0000000000000000000000000000000000000000000000000000000000000000",
    "source_pose_id": "fixture_pose_00",
    "landmarks": {"root": [512, 896], "left_foot": [410, 896], "right_foot": [614, 896], "head": [512, 95], "eye_left": [447, 427], "eye_right": [611, 427]},
    "contacts": [{"landmark": "left_foot", "active": true}, {"landmark": "right_foot", "active": true}],
    "events": [{"kind": "frame_marker", "tick": 0}]
  }],
  "loop_mode": "loop",
  "root_motion_policy": "forbidden",
  "entry_posture": "neutral",
  "exit_posture": "neutral",
  "events": [{"kind": "breath_peak", "frame_index": 0}],
  "interruptible_ranges": [[0, 1]],
  "source_checksum": "0000000000000000000000000000000000000000000000000000000000000000",
  "pack_revision": "fixture",
  "track_checksum": "0000000000000000000000000000000000000000000000000000000000000000"
}
